<?xml version="1.0" encoding="UTF-8"?>
<disco titulo="">
    <fecha dia="" mes="" anio=""/>
    <songs>
        <cancion duracion="4:47" anio="2008" xmlns:xsi="http://www.w3.org/2001/XMLSchema-instance" xsi:noNamespaceSchemaLocation="cancion.xsd">
            <titulo>Give it 2 me</titulo>
            <compositores>
                <compositor>
                    <nombre>Pharrel</nombre>
                    <apellidos>Williams</apellidos>
                </compositor>
            </compositores>
            <productores>
                <productor>
                    <nombre>Pharrel</nombre>
                    <apellidos>Williams</apellidos>
                </productor>
            </productores>
            <sello>Warner Bros. Records</sello>
            <artista>Madonna</artista>
        </cancion>
    </songs>
</disco>